Date Scraped,Source,Headline,URL,Sector Tag,Relevance Score,Angle,Content Opportunity
13-01-2025,Automatiseringsgids,AI adoption in manufacturing stijgt 40%,https://automgids.nl/ai-2025,Automation,9,Trend,TRUE
13-01-2025,Cobouw,Tekort aan werkvoorbereiders neemt toe,https://cobouw.nl/tekort-wv,Construction,8,Challenge,TRUE
13-01-2025,Energeia,Groei zonne-energie vraagt meer servicemonteurs,https://energeia.nl/solar-2025,Renewable Energy,7,Market Shift,TRUE
14-01-2025,Technisch Weekblad,Nederlandse maakindustrie investeert in robotica,https://tw.nl/robotica-2025,Manufacturing,8,Technology,TRUE
14-01-2025,Process Magazine,Tekort aan PLC programmeurs bedreigt productie,https://process.nl/plc-tekort,Process Industry,9,Skills Gap,TRUE
14-01-2025,Cobouw,Nieuwe cao bouw 2025 - hoger loon verwacht,https://cobouw.nl/cao-2025,Construction,6,Policy,FALSE
14-01-2025,Offshore Magazine,Offshore wind sector groeit 30% - nieuwe vacatures,https://offshore.nl/wind-2025,Offshore,8,Market Shift,TRUE
